{
  "v": 1,
  "kind": "idk.replay.artifact",
  "artifactVersion": 1,
  "contractVersion": "1.3.0",
  "schemaRef": "docs/schemas/artifact.v1.schema.json",
  "command": "simulate",
  "generatedAt": "2026-03-14T11:42:01.724Z",
  "meta": {
    "command": "simulate",
    "generatedAt": "2026-03-14T11:42:01.711Z",
    "contractVersion": "1.3.0",
    "schemaRef": "docs/schemas/simulate.output.schema.json",
    "cliVersion": "0.1.1",
    "gitSha": "ecc8f35",
    "runId": "compat-sim-artifact-v1",
    "seed": 17,
    "scenarioPath": "../../examples/tutorials/11-my-game-v1.json",
    "scenarioHash": "f565390058b33abb0f4108a62c6a14783fef9fdf5833c4091554c380a4671674",
    "pluginDigest": {}
  },
  "input": {
    "positional": [
      "<REPO_ROOT>/examples/tutorials/11-my-game-v1.json"
    ],
    "flags": {
      "duration": 60,
      "seed": 17,
      "run-id": "compat-sim-artifact-v1",
      "artifact-out": "../../fixtures/compat/v1/artifacts/simulate.artifact.v1.json",
      "format": "json",
      "help": false,
      "version": false,
      "plugin": "",
      "allow-plugin": false,
      "plugin-root": "",
      "plugin-sha256": "",
      "plugin-trust-file": "",
      "fast": false
    }
  },
  "replay": {
    "cwd": "<REPO_ROOT>/packages/cli",
    "args": [
      "simulate",
      "<REPO_ROOT>/examples/tutorials/11-my-game-v1.json",
      "--duration",
      "60",
      "--format",
      "json",
      "--run-id",
      "compat-sim-artifact-v1",
      "--seed",
      "17"
    ],
    "commandLine": "bun run --cwd packages/cli dev -- simulate <REPO_ROOT>/examples/tutorials/11-my-game-v1.json --duration 60 --format json --run-id compat-sim-artifact-v1 --seed 17",
    "verify": {
      "runId": "compat-sim-artifact-v1",
      "seed": 17,
      "scenarioHash": "f565390058b33abb0f4108a62c6a14783fef9fdf5833c4091554c380a4671674",
      "gitSha": "ecc8f35",
      "pluginDigest": {},
      "resultHash": "5d47b4cfc3d3d49c2f19a50055880b18af98135cf0936b52ea2c7d3281a69628"
    }
  },
  "result": {
    "run": {
      "id": "compat-sim-artifact-v1",
      "seed": 17,
      "generatedAt": "2026-03-14T11:42:01.711Z"
    },
    "scenario": "../../examples/tutorials/11-my-game-v1.json",
    "startT": 0,
    "endT": 60,
    "durationSec": 60,
    "totalElapsedSec": 60,
    "endMoney": "85.99644612435625",
    "endNetWorth": "598.9999999999999",
    "summaries": {
      "eventLog": {
        "enabled": false,
        "maxEvents": 0,
        "totalSeen": 60,
        "dropped": 60,
        "retained": 0
      }
    },
    "prestige": {
      "count": 0,
      "points": "0",
      "multiplier": "1"
    },
    "stats": {
      "money": {
        "applied": 0,
        "dropped": 0,
        "queued": 0,
        "flushed": 0,
        "blocked": 0,
        "droppedRate": 0,
        "flushRate": 0
      },
      "actions": {
        "applied": 12,
        "skippedCannotApply": 0,
        "skippedInsufficientFunds": 48
      }
    },
    "uxFlags": [],
    "eventLog": {
      "enabled": false,
      "maxEvents": 0,
      "totalSeen": 60,
      "dropped": 60,
      "retained": 0
    }
  }
}
